{
  "candidate_ids": [
    "eca:000",
    "eca:001",
    "eca:002",
    "eca:003",
    "eca:004",
    "eca:005",
    "eca:006",
    "eca:007",
    "eca:008",
    "eca:009",
    "eca:010",
    "eca:011",
    "eca:012",
    "eca:013",
    "eca:014",
    "eca:015",
    "eca:016",
    "eca:017",
    "eca:018",
    "eca:019",
    "eca:020",
    "eca:021",
    "eca:022",
    "eca:023",
    "eca:024",
    "eca:025",
    "eca:026",
    "eca:027",
    "eca:028",
    "eca:029",
    "eca:030",
    "eca:031",
    "eca:032",
    "eca:033",
    "eca:034",
    "eca:035",
    "eca:036",
    "eca:037",
    "eca:038",
    "eca:039",
    "eca:040",
    "eca:041",
    "eca:042",
    "eca:043",
    "eca:044",
    "eca:045",
    "eca:046",
    "eca:047",
    "eca:048",
    "eca:049",
    "eca:050",
    "eca:051",
    "eca:052",
    "eca:053",
    "eca:054",
    "eca:055",
    "eca:056",
    "eca:057",
    "eca:058",
    "eca:059",
    "eca:060",
    "eca:061",
    "eca:062",
    "eca:063",
    "eca:064",
    "eca:065",
    "eca:066",
    "eca:067",
    "eca:068",
    "eca:069",
    "eca:070",
    "eca:071",
    "eca:072",
    "eca:073",
    "eca:074",
    "eca:075",
    "eca:076",
    "eca:077",
    "eca:078",
    "eca:079",
    "eca:080",
    "eca:081",
    "eca:082",
    "eca:083",
    "eca:084",
    "eca:085",
    "eca:086",
    "eca:087",
    "eca:088",
    "eca:089",
    "eca:090",
    "eca:091",
    "eca:092",
    "eca:093",
    "eca:094",
    "eca:095",
    "eca:096",
    "eca:097",
    "eca:098",
    "eca:099",
    "eca:100",
    "eca:101",
    "eca:102",
    "eca:103",
    "eca:104",
    "eca:105",
    "eca:106",
    "eca:107",
    "eca:108",
    "eca:109",
    "eca:110",
    "eca:111",
    "eca:112",
    "eca:113",
    "eca:114",
    "eca:115",
    "eca:116",
    "eca:117",
    "eca:118",
    "eca:119",
    "eca:120",
    "eca:121",
    "eca:122",
    "eca:123",
    "eca:124",
    "eca:125",
    "eca:126",
    "eca:127",
    "eca:128",
    "eca:129",
    "eca:130",
    "eca:131",
    "eca:132",
    "eca:133",
    "eca:134",
    "eca:135",
    "eca:136",
    "eca:137",
    "eca:138",
    "eca:139",
    "eca:140",
    "eca:141",
    "eca:142",
    "eca:143",
    "eca:144",
    "eca:145",
    "eca:146",
    "eca:147",
    "eca:148",
    "eca:149",
    "eca:150",
    "eca:151",
    "eca:152",
    "eca:153",
    "eca:154",
    "eca:155",
    "eca:156",
    "eca:157",
    "eca:158",
    "eca:159",
    "eca:160",
    "eca:161",
    "eca:162",
    "eca:163",
    "eca:164",
    "eca:165",
    "eca:166",
    "eca:167",
    "eca:168",
    "eca:169",
    "eca:170",
    "eca:171",
    "eca:172",
    "eca:173",
    "eca:174",
    "eca:175",
    "eca:176",
    "eca:177",
    "eca:178",
    "eca:179",
    "eca:180",
    "eca:181",
    "eca:182",
    "eca:183",
    "eca:184",
    "eca:185",
    "eca:186",
    "eca:187",
    "eca:188",
    "eca:189",
    "eca:190",
    "eca:191",
    "eca:192",
    "eca:193",
    "eca:194",
    "eca:195",
    "eca:196",
    "eca:197",
    "eca:198",
    "eca:199",
    "eca:200",
    "eca:201",
    "eca:202",
    "eca:203",
    "eca:204",
    "eca:205",
    "eca:206",
    "eca:207",
    "eca:208",
    "eca:209",
    "eca:210",
    "eca:211",
    "eca:212",
    "eca:213",
    "eca:214",
    "eca:215",
    "eca:216",
    "eca:217",
    "eca:218",
    "eca:219",
    "eca:220",
    "eca:221",
    "eca:222",
    "eca:223",
    "eca:224",
    "eca:225",
    "eca:226",
    "eca:227",
    "eca:228",
    "eca:229",
    "eca:230",
    "eca:231",
    "eca:232",
    "eca:233",
    "eca:234",
    "eca:235",
    "eca:236",
    "eca:237",
    "eca:238",
    "eca:239",
    "eca:240",
    "eca:241",
    "eca:242",
    "eca:243",
    "eca:244",
    "eca:245",
    "eca:246",
    "eca:247",
    "eca:248",
    "eca:249",
    "eca:250",
    "eca:251",
    "eca:252",
    "eca:253",
    "eca:254",
    "eca:255"
  ],
  "config_hash": "953498a46c17c514d2d4bf7866c94fb4b26153d881ccdcbaa25c35531ad9bb34",
  "description_bits": 8,
  "grammar_id": "eca-binary-radius-one-v1",
  "rule_ids": [
    0,
    1,
    2,
    3,
    4,
    5,
    6,
    7,
    8,
    9,
    10,
    11,
    12,
    13,
    14,
    15,
    16,
    17,
    18,
    19,
    20,
    21,
    22,
    23,
    24,
    25,
    26,
    27,
    28,
    29,
    30,
    31,
    32,
    33,
    34,
    35,
    36,
    37,
    38,
    39,
    40,
    41,
    42,
    43,
    44,
    45,
    46,
    47,
    48,
    49,
    50,
    51,
    52,
    53,
    54,
    55,
    56,
    57,
    58,
    59,
    60,
    61,
    62,
    63,
    64,
    65,
    66,
    67,
    68,
    69,
    70,
    71,
    72,
    73,
    74,
    75,
    76,
    77,
    78,
    79,
    80,
    81,
    82,
    83,
    84,
    85,
    86,
    87,
    88,
    89,
    90,
    91,
    92,
    93,
    94,
    95,
    96,
    97,
    98,
    99,
    100,
    101,
    102,
    103,
    104,
    105,
    106,
    107,
    108,
    109,
    110,
    111,
    112,
    113,
    114,
    115,
    116,
    117,
    118,
    119,
    120,
    121,
    122,
    123,
    124,
    125,
    126,
    127,
    128,
    129,
    130,
    131,
    132,
    133,
    134,
    135,
    136,
    137,
    138,
    139,
    140,
    141,
    142,
    143,
    144,
    145,
    146,
    147,
    148,
    149,
    150,
    151,
    152,
    153,
    154,
    155,
    156,
    157,
    158,
    159,
    160,
    161,
    162,
    163,
    164,
    165,
    166,
    167,
    168,
    169,
    170,
    171,
    172,
    173,
    174,
    175,
    176,
    177,
    178,
    179,
    180,
    181,
    182,
    183,
    184,
    185,
    186,
    187,
    188,
    189,
    190,
    191,
    192,
    193,
    194,
    195,
    196,
    197,
    198,
    199,
    200,
    201,
    202,
    203,
    204,
    205,
    206,
    207,
    208,
    209,
    210,
    211,
    212,
    213,
    214,
    215,
    216,
    217,
    218,
    219,
    220,
    221,
    222,
    223,
    224,
    225,
    226,
    227,
    228,
    229,
    230,
    231,
    232,
    233,
    234,
    235,
    236,
    237,
    238,
    239,
    240,
    241,
    242,
    243,
    244,
    245,
    246,
    247,
    248,
    249,
    250,
    251,
    252,
    253,
    254,
    255
  ],
  "schema_version": "1",
  "source_hash": "67ffbab1129e36147f027c7528f332ee552de5213ed70a6e0bd65a3693a69490",
  "terminal_status_vocabulary": [
    "EXECUTED"
  ]
}
